{
  "site": "ripaid-standin",
  "reference_frame": "stills/1792910002.000.jpg",
  "zones": [
    {
      "id": "surf",
      "kind": "water",
      "polygon": [[0, 470], [1280, 450], [1280, 712], [1100, 700], [900, 692], [640, 680], [320, 674], [0, 662]]
    },
    {
      "id": "beach",
      "kind": "beach",
      "polygon": [[0, 662], [320, 674], [640, 680], [900, 692], [1100, 700], [1280, 712], [1280, 805], [640, 800], [0, 775]]
    }
  ],
  "spaces": []
}
